{
  "schemaVersion": "ai-expected-panel-behavior.v1",
  "panelId": "readiness-panel",
  "expectedClass": "NEGATIVE_NOT_REACHED",
  "assertions": [
    {
      "path": "actual.observations.customPanel.route",
      "equals": "/learners/readiness"
    },
    {
      "path": "actual.observations.customPanel.layoutType",
      "equals": "table"
    }
  ]
}
